### ISSUE TITLE
segfault when running the tpacket3 example

### ISSUE THREAD

**Issue by nuel77** [sensorfu/luomu-libpcap#87]
i was running an implementation based on the tpacketv3 examples folder, sometimes i recv an empty packet - size 0, which will cause the iterator to segfault, somtimes a larger packet can also come in causing seg fault..

```rust
loop {
        if exit.load(Ordering::Relaxed) {
            println!("exiting");
            packet_reader.flush_block();
            break;
        }

        match packet_reader.wait_block(Duration::from_millis(500)) {
            Ok(pkt_iterator) => {
                println!("recvd pkt");
                for pkt in pkt_iterator {
                    let pkt = pkt.packet();
                    let len = pkt.len();
                    println!("size {len:?}");
                    if len == 0 {
                        break;
                    }
                }
                println!("flushing block");
                packet_reader.flush_block()
            }
            Err(e) => match e {
                WaitError::Timeout => {
                    println!("timeout");
                    thread::sleep(Duration::from_millis(1))
                },
                WaitError::IoError(e) => {
                    println!("error in loop io {e:?}");
                    break;
                }
                WaitError::BlockNotReady => {
                    thread::sleep(Duration::from_millis(1));
                }
            },
        }
        //dedup
    }
```

## Output
```

 sudo ./target/debug/shred-relay --iface eno1 --tvu-ports 9001
tframesize 48
recvd pkt
size 166
size 250
size 138
size 250
size 234
size 152
size 138
size 138
flushing block
recvd pkt
size 2108744755
Segmentation fault
```

**Comment by jtt** [comment]
Thank you for the report, this looks a lot like we somehow read from invalid block or miscalculate offset for next packet. Can you run this with tracing enabled (at trace level), just in case that will reveal some further information. 

If possible, could you share a pcap file of the traffic while this occurs?

**Comment by nuel77** [comment]
i ran both of them together in the same terminal so logs will be mixed. after receiving 
`2025-12-03T09:50:39.172537Z TRACE luomu_tpacketv3: Block 1 ready with 51118683 packets`, the program immediatly segfaulted. but as u can see from the logs my eno1 interface never received that many packets. guessing some issue with how the block_descriptor is read (?)

```
RUST_LOG=trace sudo ./target/debug/shred-relay --iface eno1 & sudo tcpdump -i eno1
[1] 1196751
tframesize 48
2025-12-03T09:50:38.961890Z TRACE luomu_tpacketv3::socket: Created socket with fd=3
2025-12-03T09:50:38.961922Z TRACE luomu_tpacketv3: Index for interface eno1 is 2
2025-12-03T09:50:38.961933Z TRACE luomu_tpacketv3: Setting packet version
2025-12-03T09:50:38.961943Z TRACE luomu_tpacketv3::socket: option value ptr=0x7fff77d3f3ac oplen=4
2025-12-03T09:50:38.961959Z TRACE luomu_tpacketv3: setting RX_PACKET request
2025-12-03T09:50:38.961969Z TRACE luomu_tpacketv3::socket: option value ptr=0x7fff77d3f4b4 oplen=28
2025-12-03T09:50:38.976491Z TRACE luomu_tpacketv3: Setting PROMISC mode
2025-12-03T09:50:38.976523Z TRACE luomu_tpacketv3::socket: option value ptr=0x7fff77d3f6e0 oplen=16
2025-12-03T09:50:38.976566Z TRACE luomu_tpacketv3: Mapping ring
2025-12-03T09:50:38.984585Z TRACE luomu_tpacketv3: binding to interface
tcpdump: verbose output suppressed, use -v[v]... for full protocol decode
listening on eno1, link-type EN10MB (Ethernet), snapshot length 262144 bytes
2025-12-03T09:50:38.997732Z TRACE luomu_tpacketv3: Waiting block 0
2025-12-03T09:50:39.068613Z TRACE luomu_tpacketv3: Block 0 ready with 10 packets
2025-12-03T09:50:39.068676Z  INFO shred_relay: recvd pkt
2025-12-03T09:50:39.068692Z TRACE luomu_tpacketv3: Consuming packet 0/10
2025-12-03T09:50:39.068714Z  INFO shred_relay: size 458
2025-12-03T09:50:39.068727Z TRACE luomu_tpacketv3: Consuming packet 1/10
2025-12-03T09:50:39.068739Z  INFO shred_relay: size 158
2025-12-03T09:50:39.068751Z TRACE luomu_tpacketv3: Consuming packet 2/10
2025-12-03T09:50:39.068764Z  INFO shred_relay: size 158
2025-12-03T09:50:39.068775Z TRACE luomu_tpacketv3: Consuming packet 3/10
2025-12-03T09:50:39.068788Z  INFO shred_relay: size 270
2025-12-03T09:50:39.068799Z TRACE luomu_tpacketv3: Consuming packet 4/10
2025-12-03T09:50:39.068812Z  INFO shred_relay: size 158
2025-12-03T09:50:39.068823Z TRACE luomu_tpacketv3: Consuming packet 5/10
2025-12-03T09:50:39.068836Z  INFO shred_relay: size 410
2025-12-03T09:50:39.068847Z TRACE luomu_tpacketv3: Consuming packet 6/10
2025-12-03T09:50:39.068861Z  INFO shred_relay: size 158
2025-12-03T09:50:39.068873Z TRACE luomu_tpacketv3: Consuming packet 7/10
2025-12-03T09:50:39.068886Z  INFO shred_relay: size 250
2025-12-03T09:50:39.068898Z TRACE luomu_tpacketv3: Consuming packet 8/10
2025-12-03T09:50:39.068912Z  INFO shred_relay: size 250
2025-12-03T09:50:39.068924Z TRACE luomu_tpacketv3: Consuming packet 9/10
2025-12-03T09:50:39.068938Z  INFO shred_relay: size 158
2025-12-03T09:50:39.068951Z  INFO shred_relay: flushing block
2025-12-03T09:50:39.068965Z TRACE luomu_tpacketv3: Flushing block 0
2025-12-03T09:50:39.068979Z TRACE luomu_tpacketv3: Waiting block 1
09:50:39.000354 IP astralane-local.41641 > 192.168.1.13.41641: UDP, length 416
09:50:39.006358 IP6 2401:4900:1cbc:2655:5834:850a:75ec:86d3.41641 > astralane-local.41641: UDP, length 96
09:50:39.006402 IP6 2401:4900:1cbc:2655:5834:850a:75ec:86d3.41641 > astralane-local.41641: UDP, length 96
09:50:39.006514 IP6 2401:4900:1cbc:2655:5834:850a:75ec:86d3.41641 > astralane-local.41641: UDP, length 208
09:50:39.006578 IP6 2401:4900:1cbc:2655:5834:850a:75ec:86d3.41641 > astralane-local.41641: UDP, length 96
09:50:39.008676 IP astralane-local.41641 > 192.168.1.13.41641: UDP, length 368
09:50:39.021901 IP6 2401:4900:1cbc:2655:5834:850a:75ec:86d3.41641 > astralane-local.41641: UDP, length 96
09:50:39.029147 IP astralane-local.41641 > 192.168.1.13.41641: UDP, length 208
09:50:39.049260 IP astralane-local.41641 > 192.168.1.13.41641: UDP, length 208
09:50:39.051118 IP6 2401:4900:1cbc:2655:5834:850a:75ec:86d3.41641 > astralane-local.41641: UDP, length 96
2025-12-03T09:50:39.172537Z TRACE luomu_tpacketv3: Block 1 ready with 51118683 packets
2025-12-03T09:50:39.172600Z  INFO shred_relay: recvd pkt
2025-12-03T09:50:39.172615Z TRACE luomu_tpacketv3: Consuming packet 0/51118683
2025-12-03T09:50:39.172629Z  INFO shred_relay: size 0
2025-12-03T09:50:39.172642Z TRACE luomu_tpacketv3: Consuming packet 1/51118683
09:50:39.077362 IP6 astralane-local.49887 > 2401:4900:50:9::66.domain: 32576+ [1au] PTR? 13.1.168.192.in-addr.arpa. (54)
09:50:39.082108 IP6 2401:4900:50:9::66.domain > astralane-local.49887: 32576 NXDomain 0/1/1 (131)
09:50:39.082797 IP6 astralane-local.32845 > 2401:4900:50:9::66.domain: 31258+ [1au] PTR? 11.1.168.192.in-addr.arpa. (54)
09:50:39.083414 IP astralane-local.41641 > 192.168.1.13.41641: UDP, length 1312
09:50:39.083420 IP astralane-local.41641 > 192.168.1.13.41641: UDP, length 912
09:50:39.086094 IP6 2401:4900:50:9::66.domain > astralane-local.32845: 31258 NXDomain 0/1/1 (131)
09:50:39.086996 IP6 astralane-local.54532 > 2401:4900:50:9::66.domain: 52533+ [1au] PTR? c.5.a.c.3.e.e.f.f.f.f.e.c.e.e.3.5.5.6.2.c.b.c.1.0.0.9.4.1.0.4.2.ip6.arpa. (101)
09:50:39.089243 IP6 2401:4900:1cbc:2655:5834:850a:75ec:86d3.41641 > astralane-local.41641: UDP, length 96
09:50:39.089512 IP astralane-local.41641 > 192.168.1.13.41641: UDP, length 352
09:50:39.093392 IP astralane-local.41641 > 192.168.1.13.41641: UDP, length 1312
09:50:39.093397 IP astralane-local.41641 > 192.168.1.13.41641: UDP, length 816
09:50:39.103636 IP 192.168.1.14.37147 > 239.255.255.250.1900: UDP, length 173
09:50:39.109619 IP6 2401:4900:50:9::66.domain > astralane-local.54532: 52533 NXDomain 0/0/1 (101)
09:50:39.109845 IP astralane-local.41641 > 192.168.1.13.41641: UDP, length 464
09:50:39.110807 IP6 astralane-local.53755 > 2401:4900:50:9::66.domain: 63317+ [1au] PTR? 3.d.6.8.c.e.5.7.a.0.5.8.4.3.8.5.5.5.6.2.c.b.c.1.0.0.9.4.1.0.4.2.ip6.arpa. (101)
09:50:39.113092 IP6 2401:4900:1cbc:2655:5834:850a:75ec:86d3.41641 > astralane-local.41641: UDP, length 96
09:50:39.130045 IP astralane-local.41641 > 192.168.1.13.41641: UDP, length 208
09:50:39.132575 IP6 2401:4900:50:9::66.domain > astralane-local.53755: 63317 NXDomain 0/0/1 (101)
09:50:39.144159 IP astralane-local.41641 > 192.168.1.13.41641: UDP, length 1312
09:50:39.144166 IP astralane-local.41641 > 192.168.1.13.41641: UDP, length 880
09:50:39.147466 IP6 2401:4900:1cbc:2655:5834:850a:75ec:86d3.41641 > astralane-local.41641: UDP, length 96
09:50:39.150035 IP astralane-local.41641 > 192.168.1.13.41641: UDP, length 352
09:50:39.166979 IP6 2401:4900:1cbc:2655:5834:850a:75ec:86d3.41641 > astralane-local.41641: UDP, length 96
09:50:39.170390 IP astralane-local.41641 > 192.168.1.13.41641: UDP, length 320
09:50:39.181329 IP6 astralane-local.43798 > 2401:4900:50:9::66.domain: 15354+ [1au] PTR? 6.6.0.0.0.0.0.0.0.0.0.0.0.0.0.0.9.0.0.0.0.5.0.0.0.0.9.4.1.0.4.2.ip6.arpa. (101)
09:50:39.184640 IP astralane-local.41641 > 192.168.1.13.41641: UDP, length 1312
09:50:39.184645 IP astralane-local.41641 > 192.168.1.13.41641: UDP, length 576
09:50:39.188543 IP6 2401:4900:1cbc:2655:5834:850a:75ec:86d3.41641 > astralane-local.41641: UDP, length 96
09:50:39.188719 IP6 2401:4900:1cbc:2655:5834:850a:75ec:86d3.41641 > astralane-local.41641: UDP, length 96
09:50:39.190374 IP astralane-local.41641 > 192.168.1.13.41641: UDP, length 352
09:50:39.204786 IP6 2401:4900:50:9::66.domain > astralane-local.43798: 15354 NXDomain 0/0/1 (101)
09:50:39.205973 IP6 astralane-local.35110 > 2401:4900:50:9::66.domain: 63903+ [1au] PTR? 250.255.255.239.in-addr.arpa. (57)
09:50:39.210590 IP astralane-local.41641 > 192.168.1.13.41641: UDP, length 320
09:50:39.210792 IP6 2401:4900:50:9::66.domain > astralane-local.35110: 63903 NXDomain 0/1/1 (114)
09:50:39.211340 IP6 astralane-local.35034 > 2401:4900:50:9::66.domain: 28611+ [1au] PTR? 14.1.168.192.in-addr.arpa. (54)
09:50:39.214839 IP6 2401:4900:50:9::66.domain > astralane-local.35034: 28611 NXDomain 0/1/1 (131)
09:50:39.214886 IP astralane-local.41641 > 192.168.1.13.41641: UDP, length 1312
09:50:39.214891 IP astralane-local.41641 > 192.168.1.13.41641: UDP, length 544
09:50:39.221217 IP6 2401:4900:1cbc:2655:5834:850a:75ec:86d3.41641 > astralane-local.41641: UDP, length 96
09:50:39.221308 IP6 2401:4900:1cbc:2655:5834:850a:75ec:86d3.41641 > astralane-local.41641: UDP, length 96
09:50:39.224364 IP astralane-local.41641 > 192.168.1.13.41641: UDP, length 896
09:50:39.227169 IP6 2401:4900:1cbc:2655:5834:850a:75ec:86d3.41641 > astralane-local.41641: UDP, length 208
09:50:39.229464 IP6 2401:4900:1cbc:2655:5834:850a:75ec:86d3.41641 > astralane-local.41641: UDP, length 96
09:50:39.230600 IP astralane-local.41641 > 192.168.1.13.41641: UDP, length 208
09:50:39.238380 IP astralane-local.41641 > 192.168.1.13.41641: UDP, length 928
09:50:39.248469 IP6 2401:4900:1cbc:2655:5834:850a:75ec:86d3.41641 > astralane-local.41641: UDP, length 208
09:50:39.250872 IP astralane-local.41641 > 192.168.1.13.41641: UDP, length 464
09:50:39.253883 IP6 2401:4900:1cbc:2655:5834:850a:75ec:86d3.41641 > astralane-local.41641: UDP, length 96
09:50:39.256242 IP6 2401:4900:1cbc:2655:5834:850a:75ec:86d3.41641 > astralane-local.41641: UDP, length 96
09:50:39.263337 IP 192.168.1.14.50159 > 239.255.255.250.1900: UDP, length 168
09:50:39.268322 IP6 2401:4900:1cbc:2655:5834:850a:75ec:86d3.41641 > astralane-local.41641: UDP, length 208
09:50:39.273073 IP astralane-local.41641 > 192.168.1.13.41641: UDP, length 192
09:50:39.285364 IP6 2401:4900:1cbc:2655:5834:850a:75ec:86d3.41641 > astralane-local.41641: UDP, length 96
09:50:39.295269 IP astralane-local.41641 > 192.168.1.13.41641: UDP, length 928
09:50:39.297143 IP6 2401:4900:1cbc:2655:5834:850a:75ec:86d3.41641 > astralane-local.41641: UDP, length 336
09:50:39.301898 IP6 2401:4900:1cbc:2655:5834:850a:75ec:86d3.41641 > astralane-local.41641: UDP, length 96
09:50:39.303692 IP astralane-local.41641 > 192.168.1.13.41641: UDP, length 1312
09:50:39.303697 IP astralane-local.41641 > 192.168.1.13.41641: UDP, length 240
09:50:39.310999 IP astralane-local.41641 > 192.168.1.13.41641: UDP, length 208
09:50:39.316613 IP6 2401:4900:1cbc:2655:5834:850a:75ec:86d3.41641 > astralane-local.41641: UDP, length 640
09:50:39.321820 IP astralane-local.41641 > 192.168.1.13.41641: UDP, length 208
09:50:39.325484 IP astralane-local.41641 > 192.168.1.13.41641: UDP, length 416
09:50:39.327201 IP6 2401:4900:1cbc:2655:5834:850a:75ec:86d3.41641 > astralane-local.41641: UDP, length 96
09:50:39.327400 IP6 2401:4900:1cbc:2655:5834:850a:75ec:86d3.41641 > astralane-local.41641: UDP, length 96
09:50:39.329447 IP astralane-local.41641 > 192.168.1.13.41641: UDP, length 1312
09:50:39.329450 IP astralane-local.41641 > 192.168.1.13.41641: UDP, length 1312
09:50:39.329518 IP astralane-local.41641 > 192.168.1.13.41641: UDP, length 1312
09:50:39.329523 IP astralane-local.41641 > 192.168.1.13.41641: UDP, length 768
09:50:39.330926 IP6 2401:4900:1cbc:2655:5834:850a:75ec:86d3.41641 > astralane-local.41641: UDP, length 96
09:50:39.351721 IP6 2401:4900:1cbc:2655:5834:850a:75ec:86d3.41641 > astralane-local.41641: UDP, length 96
09:50:39.396568 IP astralane-local.41641 > 192.168.1.13.41641: UDP, length 1152
09:50:39.411930 IP astralane-local.41641 > 192.168.1.13.41641: UDP, length 208
09:50:39.421358 IP6 2401:4900:1cbc:2655:5834:850a:75ec:86d3.41641 > astralane-local.41641: UDP, length 96
09:50:39.430963 IP6 2401:4900:1cbc:2655:5834:850a:75ec:86d3.41641 > astralane-local.41641: UDP, length 96
09:50:39.432365 IP astralane-local.41641 > 192.168.1.13.41641: UDP, length 208
09:50:39.436479 IP6 astralane-local > 2401:4900:1cbc:2655:5834:850a:75ec:86d3: ICMP6, neighbor solicitation, who has 2401:4900:1cbc:2655:5834:850a:75ec:86d3, length 32
09:50:39.442476 IP6 fe80::3d:a46a:e839:6673 > astralane-local: ICMP6, neighbor advertisement, tgt is 2401:4900:1cbc:2655:5834:850a:75ec:86d3, length 24
09:50:39.450533 IP6 2401:4900:1cbc:2655:5834:850a:75ec:86d3.41641 > astralane-local.41641: UDP, length 96
09:50:39.497910 IP astralane-local.41641 > 192.168.1.13.41641: UDP, length 384
09:50:39.507970 IP astralane-local.41641 > 192.168.1.13.41641: UDP, length 464
09:50:39.512736 IP astralane-local.41641 > 192.168.1.13.41641: UDP, length 192
09:50:39.514028 IP6 2401:4900:1cbc:2655:5834:850a:75ec:86d3.41641 > astralane-local.41641: UDP, length 96
09:50:39.514607 IP6 2401:4900:1cbc:2655:5834:850a:75ec:86d3.41641 > astralane-local.41641: UDP, length 96
09:50:39.516181 IP6 2401:4900:1cbc:2655:5834:850a:75ec:86d3.41641 > astralane-local.41641: UDP, length 96
09:50:39.533006 IP astralane-local.41641 > 192.168.1.13.41641: UDP, length 224
09:50:39.552818 IP6 2401:4900:1cbc:2655:5834:850a:75ec:86d3.41641 > astralane-local.41641: UDP, length 96
09:50:39.552898 IP6 2401:4900:1cbc:2655:5834:850a:75ec:86d3.41641 > astralane-local.41641: UDP, length 288
09:50:39.593672 IP astralane-local.41641 > 192.168.1.13.41641: UDP, length 96
09:50:39.610059 IP astralane-local.41641 > 192.168.1.13.41641: UDP, length 448
09:50:39.613747 IP astralane-local.41641 > 192.168.1.13.41641: UDP, length 192
09:50:39.628509 IP6 2401:4900:1cbc:2655:5834:850a:75ec:86d3.41641 > astralane-local.41641: UDP, length 96
09:50:39.634063 IP astralane-local.41641 > 192.168.1.13.41641: UDP, length 208
09:50:39.641046 IP astralane-local.41641 > 192.168.1.13.41641: UDP, length 176
09:50:39.646783 IP6 2401:4900:1cbc:2655:5834:850a:75ec:86d3.41641 > astralane-local.41641: UDP, length 96
09:50:39.646817 IP6 2401:4900:1cbc:2655:5834:850a:75ec:86d3.41641 > astralane-local.41641: UDP, length 96
09:50:39.700254 IP6 2401:4900:1cbc:2655:5834:850a:75ec:86d3.41641 > astralane-local.41641: UDP, length 192
09:50:39.700592 IP astralane-local.41641 > 192.168.1.13.41641: UDP, length 96
09:50:39.711710 IP astralane-local.41641 > 192.168.1.13.41641: UDP, length 416
09:50:39.721087 IP6 2401:4900:1cbc:2655:5834:850a:75ec:86d3.41641 > astralane-local.41641: UDP, length 96
09:50:39.734815 IP astralane-local.41641 > 192.168.1.13.41641: UDP, length 208
09:50:39.744836 IP6 2401:4900:1cbc:2655:5834:850a:75ec:86d3.41641 > astralane-local.41641: UDP, length 96
09:50:39.813813 IP astralane-local.41641 > 192.168.1.13.41641: UDP, length 384
09:50:39.836125 IP astralane-local.41641 > 192.168.1.13.41641: UDP, length 208
09:50:39.839596 IP6 2401:4900:1cbc:2655:5834:850a:75ec:86d3.41641 > astralane-local.41641: UDP, length 96
09:50:39.847424 IP6 2401:4900:1cbc:2655:5834:850a:75ec:86d3.41641 > astralane-local.41641: UDP, length 96
09:50:39.908333 IP _gateway > all-systems.mcast.net: igmp query v2
09:50:39.909558 IP6 astralane-local.55856 > 2401:4900:50:9::66.domain: 53651+ [1au] PTR? 1.1.168.192.in-addr.arpa. (53)
09:50:39.913796 IP6 2401:4900:50:9::66.domain > astralane-local.55856: 53651 NXDomain 0/1/1 (130)
09:50:39.915880 IP astralane-local.41641 > 192.168.1.13.41641: UDP, length 384
09:50:39.919085 IP astralane-local.41641 > 192.168.1.13.41641: UDP, length 480
09:50:39.925795 IP astralane-local.41641 > 192.168.1.13.41641: UDP, length 400
09:50:39.932336 IP6 2401:4900:1cbc:2655:5834:850a:75ec:86d3.41641 > astralane-local.41641: UDP, length 96
09:50:39.936703 IP astralane-local.41641 > 192.168.1.13.41641: UDP, length 208
09:50:39.956975 IP astralane-local.41641 > 192.168.1.13.41641: UDP, length 208
09:50:39.959735 IP6 2401:4900:1cbc:2655:5834:850a:75ec:86d3.41641 > astralane-local.41641: UDP, length 96
09:50:39.972317 IP6 2401:4900:1cbc:2655:5834:850a:75ec:86d3.41641 > astralane-local.41641: UDP, length 96
09:50:40.004353 IP6 2401:4900:1cbc:2655:5834:850a:75ec:86d3.41641 > astralane-local.41641: UDP, length 224
09:50:40.008621 IP astralane-local.41641 > 192.168.1.13.41641: UDP, length 208
09:50:40.017708 IP astralane-local.41641 > 192.168.1.13.41641: UDP, length 592
09:50:40.037444 IP astralane-local.41641 > 192.168.1.13.41641: UDP, length 192
09:50:40.048450 IP6 2401:4900:1cbc:2655:5834:850a:75ec:86d3.41641 > astralane-local.41641: UDP, length 96
09:50:40.048486 IP6 2401:4900:1cbc:2655:5834:850a:75ec:86d3.41641 > astralane-local.41641: UDP, length 96
09:50:40.057791 IP astralane-local.41641 > 192.168.1.13.41641: UDP, length 208
09:50:40.072888 IP6 2401:4900:1cbc:2655:5834:850a:75ec:86d3.41641 > astralane-local.41641: UDP, length 96
09:50:40.129611 IP astralane-local.41641 > 192.168.1.13.41641: UDP, length 400
09:50:40.136680 IP6 2401:4900:1cbc:2655:5834:850a:75ec:86d3.41641 > astralane-local.41641: UDP, length 96
09:50:40.138445 IP astralane-local.41641 > 192.168.1.13.41641: UDP, length 192
09:50:40.142853 IP6 2401:4900:1cbc:2655:5834:850a:75ec:86d3.41641 > astralane-local.41641: UDP, length 96
09:50:40.158629 IP astralane-local.41641 > 192.168.1.13.41641: UDP, length 224
09:50:40.158821 IP6 2401:4900:1cbc:2655:5834:850a:75ec:86d3.41641 > astralane-local.41641: UDP, length 124
09:50:40.158993 IP6 astralane-local.41641 > 2401:4900:1cbc:2655:5834:850a:75ec:86d3.41641: UDP, length 110
09:50:40.175836 IP6 2401:4900:1cbc:2655:5834:850a:75ec:86d3.41641 > astralane-local.41641: UDP, length 96
09:50:40.230965 IP astralane-local.41641 > 192.168.1.13.41641: UDP, length 416
09:50:40.239294 IP astralane-local.41641 > 192.168.1.13.41641: UDP, length 192
09:50:40.259680 IP astralane-local.41641 > 192.168.1.13.41641: UDP, length 208
09:50:40.273337 IP6 2401:4900:1cbc:2655:5834:850a:75ec:86d3.41641 > astralane-local.41641: UDP, length 96
09:50:40.294097 IP6 2401:4900:1cbc:2655:5834:850a:75ec:86d3.41641 > astralane-local.41641: UDP, length 96
09:50:40.332747 IP astralane-local.41641 > 192.168.1.13.41641: UDP, length 368
09:50:40.340200 IP astralane-local.41641 > 192.168.1.13.41641: UDP, length 192
09:50:40.359039 IP6 2401:4900:1cbc:2655:5834:850a:75ec:86d3.41641 > astralane-local.41641: UDP, length 96
09:50:40.360721 IP astralane-local.41641 > 192.168.1.13.41641: UDP, length 208
09:50:40.380144 IP6 2401:4900:1cbc:2655:5834:850a:75ec:86d3.41641 > astralane-local.41641: UDP, length 96
09:50:40.434634 IP astralane-local.41641 > 192.168.1.13.41641: UDP, length 384
09:50:40.441335 IP astralane-local.41641 > 192.168.1.13.41641: UDP, length 192
09:50:40.458249 IP6 2401:4900:1cbc:2655:5834:850a:75ec:86d3.41641 > astralane-local.41641: UDP, length 96
09:50:40.461733 IP astralane-local.41641 > 192.168.1.13.41641: UDP, length 208
09:50:40.480086 IP6 2401:4900:1cbc:2655:5834:850a:75ec:86d3.41641 > astralane-local.41641: UDP, length 96
09:50:40.537694 IP6 2401:4900:1cbc:2655:5834:850a:75ec:86d3.41641 > astralane-local.41641: UDP, length 224
09:50:40.542768 IP astralane-local.41641 > 192.168.1.13.41641: UDP, length 320
09:50:40.546297 IP astralane-local.41641 > 192.168.1.13.41641: UDP, length 384
09:50:40.556383 IP6 2401:4900:1cbc:2655:5834:850a:75ec:86d3.41641 > astralane-local.41641: UDP, length 96
09:50:40.559519 IP6 2401:4900:1cbc:2655:5834:850a:75ec:86d3.41641 > astralane-local.41641: UDP, length 208
09:50:40.562739 IP astralane-local.41641 > 192.168.1.13.41641: UDP, length 208
09:50:40.576777 IP6 2401:4900:1cbc:2655:5834:850a:75ec:86d3.41641 > astralane-local.41641: UDP, length 96
09:50:40.583170 IP astralane-local.41641 > 192.168.1.13.41641: UDP, length 208
09:50:40.599913 IP6 2401:4900:1cbc:2655:5834:850a:75ec:86d3.41641 > astralane-local.41641: UDP, length 96
09:50:40.641254 IP astralane-local.41641 > 192.168.1.13.41641: UDP, length 176
09:50:40.648226 IP astralane-local.41641 > 192.168.1.13.41641: UDP, length 416
09:50:40.649857 IP6 2401:4900:1cbc:2655:5834:850a:75ec:86d3.41641 > astralane-local.41641: UDP, length 96
09:50:40.663842 IP astralane-local.41641 > 192.168.1.13.41641: UDP, length 192
09:50:40.682780 IP6 2401:4900:1cbc:2655:5834:850a:75ec:86d3.41641 > astralane-local.41641: UDP, length 96
09:50:40.682815 IP6 2401:4900:1cbc:2655:5834:850a:75ec:86d3.41641 > astralane-local.41641: UDP, length 96
09:50:40.684073 IP astralane-local.41641 > 192.168.1.13.41641: UDP, length 208
09:50:40.703666 IP6 2401:4900:1cbc:2655:5834:850a:75ec:86d3.41641 > astralane-local.41641: UDP, length 96
09:50:40.703850 IP6 2401:4900:1cbc:2655:5834:850a:75ec:86d3.41641 > astralane-local.41641: UDP, length 192
^C
175 packets captured
179 packets received by filter
0 packets dropped by kernel
[1]+  Segmentation fault      RUST_LOG=trace sudo ./target/debug/shred-relay --iface eno1
```

**Comment by nuel77** [comment]
there subtle difference in tpacket_header_v1 structs used in this crate and one in libc in `seq_num` and in alignments. not sure if that is main cause

<img width="1225" height="382" alt="Image" src="https://github.com/user-attachments/assets/da7596a6-5ba7-4b26-a76d-bed224a0aa43" />

**Comment by ssh65** [comment]
I faced the same issue -
Os - Ubuntu 24.04.3
kernel - 6.8.0-88-generic
arch - x86_64

This is happening when wait_block is called for the second time and I start reading the packets from the block. Also, I noticed that the packet count for the second block did not get updated (it was the same before calling wait_block). I commented out block_index increment in flush_block function (https://github.com/sensorfu/luomu-libpcap/blob/6af9dbd7c0b5c7fc7e4dd24b5b2a6c51b7e8c873/luomu-tpacketv3/src/lib.rs#L314) which made it work for the second block (technically the same index) but then I ended up getting continuous timeouts from wait_block function.

**Comment by ssh65** [comment]
Raised pr - https://github.com/sensorfu/luomu-libpcap/pull/88

**Comment by jtt** [comment]
This was indeed a regression introduced by fixing some clippy warnings.  Thanks for @ssh65 for providing the fix. Could you verify that the issue is indeed fixed by #89
